<?xml version="1.0" encoding="UTF-8" ?>
<!DOCTYPE teamOverview SYSTEM "https://teamplanner.schimweg.net/teamplanner.dtd" >

<teamOverview xmlns="https://teamplanner.schimweg.net/teamplanner.dtd">
    <team name="Mein Team">
        <description>Das hier ist ein supercooles Team!</description>
        <memberDefinition leader="true" you="true" startTime="08:00" endTime="16:00" id="25" name="Luca Schimweg" />
        <memberDefinition id="26" name="Hendrik Leier" />
    </team>

    <jobDefinition name="Mein Superjob" duration="20" id="123">
        <member id="25"/>
    </jobDefinition>

    <jobDefinition name="Mein zweiter Job" duration="20" id="456">
        <description>Das hier ist ein Job</description>
        <dependsOn id="123" />
        <member id="25"/>
    </jobDefinition>
</teamOverview>
